{
  "contract_version": "1.0",
  "query_id": "aaaaaaaa-0001-0001-0001-000000000001",
  "round": 1,
  "case_id": "test-case-001",
  "target_module": "ram",
  "entity": {
    "type": "hash_sha256",
    "value": "e3b0c44298fc1c149afbf4c8996fb92427ae41e4649b934ca495991b7852b855"
  },
  "context": {
    "source_module": "orchestrator",
    "source_finding_id": "test-f001",
    "reason": "Check if this file hash appears in RAM artifacts"
  },
  "scope": {
    "max_evidence_lines": 50,
    "include_related_entities": true,
    "time_window": null
  }
}
